{
  "$schema": "../schema.json",
  "topico": "mrp",
  "disciplina": "Planejamento e Controle da Produção",
  "licao": "m03-l5",
  "gerado_por": "scripts/questoes/mrp.js",
  "questoes": [
    {
      "licao": "m03-l5",
      "topico": "mrp",
      "estilo": "autoral",
      "id": "mrp-f01",
      "nivel": "facil",
      "tipo": "multipla",
      "tags": [
        "demanda dependente",
        "conceito"
      ],
      "referencia": "SLACK, N.; BRANDON-JONES, A.; JOHNSTON, R. Administração da Produção. Atlas, cap. de MRP e ERP.",
      "pergunta": "Uma fábrica de bombons vende caixas prontas e monta cada caixa com bandejas plásticas compradas. Qual item tem **demanda dependente**?",
      "opcoes": [
        "A bandeja plástica usada na montagem da caixa",
        "A caixa de bombons vendida ao supermercado",
        "A caixa de bombons vendida pelo site",
        "A caixa avulsa vendida como peça de reposição a um cliente"
      ],
      "correta": 0,
      "justificativas": [
        "Certo: a quantidade de bandejas é calculada a partir do plano de caixas; depende de outro item.",
        "A caixa vendida ao varejo é produto final: sua demanda vem do mercado (independente) e é prevista.",
        "Mesmo canal diferente, continua sendo venda de produto final: demanda independente.",
        "Peça vendida diretamente a um cliente tem demanda independente, ainda que também seja componente de outro produto."
      ],
      "explicacao": "Demanda dependente é calculada (vem do plano de outro item); demanda independente é prevista (vem do mercado). O MRP existe para os itens de demanda dependente."
    },
    {
      "licao": "m03-l5",
      "topico": "mrp",
      "estilo": "autoral",
      "id": "mrp-f02",
      "nivel": "facil",
      "tipo": "multipla",
      "tags": [
        "entradas do MRP"
      ],
      "referencia": "CORRÊA, H. L.; GIANESI, I. G. N.; CAON, M. Planejamento, Programação e Controle da Produção: MRP II/ERP. Atlas.",
      "pergunta": "Qual destas informações **não** é uma entrada básica do cálculo do MRP?",
      "opcoes": [
        "Previsão de vendas de cada componente feita pelo time comercial",
        "Plano mestre de produção (PMP)",
        "Estrutura do produto (lista de materiais)",
        "Registros de estoque, recebimentos programados e lead times"
      ],
      "correta": 0,
      "justificativas": [
        "Certo: componentes não são previstos; a necessidade deles é calculada pela explosão do PMP na estrutura.",
        "O PMP diz quanto e quando de cada produto final: é o ponto de partida do MRP.",
        "A estrutura (BOM) diz quantos componentes entram em cada unidade do item pai.",
        "Sem estoque, recebimentos e lead times não dá para calcular a necessidade líquida nem quando liberar as ordens."
      ],
      "explicacao": "Entradas do MRP: PMP + estrutura do produto + registros de estoque (com recebimentos programados e lead times). Saídas: ordens planejadas de compra e de produção."
    },
    {
      "licao": "m03-l5",
      "topico": "mrp",
      "estilo": "autoral",
      "id": "mrp-f03",
      "nivel": "facil",
      "tipo": "vf",
      "tags": [
        "necessidade líquida"
      ],
      "referencia": "TUBINO, D. F. Planejamento e Controle da Produção: teoria e prática. Atlas.",
      "pergunta": "Se o estoque disponível é maior que a necessidade bruta do período, a necessidade líquida fica negativa e reduz as compras do período seguinte.",
      "correta": false,
      "resolucao": "A necessidade líquida nunca é negativa: \\(NL = \\max(0;\\ NB - \\text{estoque disponível} - RP)\\). O que sobra não vira “necessidade negativa”: vira **estoque projetado**, que é abatido no período seguinte.",
      "explicacao": "Quando sobra estoque, NL = 0 e a sobra passa para o próximo período como estoque projetado."
    },
    {
      "licao": "m03-l5",
      "topico": "mrp",
      "estilo": "autoral",
      "id": "mrp-f04",
      "nivel": "facil",
      "tipo": "calculo",
      "tags": [
        "necessidade líquida",
        "cálculo"
      ],
      "referencia": "TUBINO, D. F. Planejamento e Controle da Produção: teoria e prática. Atlas.",
      "pergunta": "Na semana 6 a necessidade bruta de bandejas é de 500 unidades. Haverá 180 bandejas em estoque e um recebimento programado de 120. Qual é a necessidade líquida?",
      "resposta": 200,
      "unidade": "bandejas",
      "tolerancia": 0,
      "resolucao": "\\(NL = \\max(0;\\ NB - E - RP)\\)\n\\(NL = \\max(0;\\ 500 - 180 - 120) = 200\\)",
      "explicacao": "Recebimento programado é uma ordem já emitida que vai chegar: conta como disponível."
    },
    {
      "licao": "m03-l5",
      "topico": "mrp",
      "estilo": "autoral",
      "id": "mrp-f05",
      "nivel": "facil",
      "tipo": "calculo",
      "tags": [
        "explosão da estrutura",
        "BOM"
      ],
      "referencia": "SLACK, N.; BRANDON-JONES, A.; JOHNSTON, R. Administração da Produção. Atlas, cap. de MRP e ERP.",
      "figura": {
        "tipo": "bom",
        "raiz": {
          "item": "A",
          "nome": "Caixa",
          "filhos": [
            {
              "item": "B",
              "nome": "Bandeja",
              "qtd": 2,
              "filhos": [
                {
                  "item": "D",
                  "nome": "Bombom",
                  "qtd": 3
                }
              ]
            }
          ]
        },
        "legenda": "Estrutura do produto: os números indicam a quantidade por unidade do item pai."
      },
      "pergunta": "Pela estrutura acima, quantos bombons (D) são necessários para montar **40 caixas** (A)? Considere estoque zero.",
      "resposta": 240,
      "unidade": "bombons",
      "tolerancia": 0,
      "resolucao": "Multiplique as quantidades ao longo do caminho A → B → D:\n\\(B = 40 \\times 2 = 80\\)\n\\(D = 80 \\times 3 = 240\\)",
      "explicacao": "Na explosão, a quantidade de cada componente é a do pai vezes a quantidade por unidade, nível a nível."
    },
    {
      "licao": "m03-l5",
      "topico": "mrp",
      "estilo": "autoral",
      "id": "mrp-f06",
      "nivel": "facil",
      "tipo": "multipla",
      "tags": [
        "lead time",
        "liberação"
      ],
      "referencia": "CORRÊA, H. L.; GIANESI, I. G. N.; CAON, M. Planejamento, Programação e Controle da Produção: MRP II/ERP. Atlas.",
      "pergunta": "Um componente com **lead time de 2 semanas** precisa estar disponível no início da semana 6. Em que semana a ordem deve ser liberada?",
      "opcoes": [
        "Semana 4",
        "Semana 6",
        "Semana 8",
        "Semana 3"
      ],
      "correta": 0,
      "justificativas": [
        "Certo: liberação = semana da necessidade − lead time = 6 − 2 = 4.",
        "Liberar na semana 6 faz o item chegar na 8: atrasado.",
        "Somar o lead time em vez de subtrair é o erro clássico da defasagem.",
        "Liberar na 3 também atende, mas antecipa uma semana sem necessidade e gera estoque."
      ],
      "resolucao": "\\(\\text{Liberação} = \\text{semana da necessidade} - LT = 6 - 2 = 4\\)",
      "explicacao": "A defasagem pelo lead time (time phasing) é o que transforma “quanto” em “quando”."
    },
    {
      "licao": "m03-l5",
      "topico": "mrp",
      "estilo": "autoral",
      "id": "mrp-f07",
      "nivel": "facil",
      "tipo": "ordenar",
      "tags": [
        "registro MRP",
        "sequência de cálculo"
      ],
      "referencia": "FERNANDES, F. C. F.; GODINHO FILHO, M. Planejamento e Controle da Produção: dos fundamentos ao essencial. Atlas.",
      "pergunta": "Coloque em ordem os passos do cálculo de um item no registro do MRP:",
      "itens": [
        "Obter a necessidade bruta (do PMP ou das ordens do item pai)",
        "Descontar estoque disponível e recebimentos programados",
        "Calcular a necessidade líquida",
        "Aplicar a regra de lote (recebimento planejado)",
        "Defasar pelo lead time (liberação planejada)"
      ],
      "explicacao": "As liberações planejadas de um item viram necessidade bruta dos seus componentes: é assim que a explosão desce nível a nível."
    },
    {
      "licao": "m03-l5",
      "topico": "mrp",
      "estilo": "autoral",
      "id": "mrp-m01",
      "nivel": "medio",
      "tipo": "tabela",
      "tags": [
        "registro MRP",
        "lote a lote",
        "tabela"
      ],
      "referencia": "TUBINO, D. F. Planejamento e Controle da Produção: teoria e prática. Atlas.",
      "pergunta": "Complete o registro MRP da **bandeja (B)**: estoque inicial 150, lead time 1 semana, lote a lote (pede exatamente a necessidade líquida).",
      "tabela": {
        "canto": "Semana",
        "colunas": [
          "1",
          "2",
          "3",
          "4",
          "5"
        ],
        "linhas": [
          {
            "rotulo": "Necessidade bruta",
            "valores": [
              80,
              120,
              150,
              90,
              200
            ]
          },
          {
            "rotulo": "Recebimento programado",
            "valores": [
              0,
              100,
              0,
              0,
              0
            ]
          },
          {
            "rotulo": "Estoque projetado (fim)",
            "valores": [
              70,
              50,
              0,
              0,
              0
            ],
            "editar": [
              0,
              1,
              2,
              3,
              4
            ]
          },
          {
            "rotulo": "Necessidade líquida",
            "valores": [
              0,
              0,
              100,
              90,
              200
            ],
            "editar": [
              0,
              1,
              2,
              3,
              4
            ]
          },
          {
            "rotulo": "Liberação planejada",
            "valores": [
              0,
              100,
              90,
              200,